{
  "cid": "digital-bar-chart",
  "widgetSize": {
    "minW": 12,
    "minH": 10,
    "maxW": 12,
    "maxH": 36
  },
  "name": "Bar Chart (Digital Corruptions)",
  "description": "To generate bar charts to visualise the accuracy results when digital corruptions are applied",
  "dependencies": [
    {
      "cid": "aiverify_digital_corruptions"
    }
  ],
  "mockdata": [
    {
      "type": "Algorithm",
      "cid": "aiverify_digital_corruptions",
      "datapath": "digital-corruption-mock-data.json"
    }
  ]
}
