{
  "cid": "general-samples-poisson",
  "widgetSize": {
    "minW": 8,
    "minH": 7,
    "maxW": 12,
    "maxH": 36
  },
  "name": "Samples (General: Poisson Noise)",
  "description": "To generate sample images for general corruptions (poisson noise)",
  "dependencies": [
    {
      "cid": "aiverify_general_corruptions"
    }
  ],
  "mockdata": [
    {
      "type": "Algorithm",
      "cid": "aiverify_general_corruptions",
      "datapath": "general-corruption-mock-data.json"
    }
  ]
}