{
  "cid": "header1",
  "name": "Header 1",
  "tags": [
    "stock",
    "decorator",
    "header"
  ],
  "properties": [
    {
      "key": "heading1",
      "helper": "Enter the heading 1",
      "default": ""
    }
  ],
  "widgetSize": {
    "minW": 1,
    "minH": 2,
    "maxW": 12,
    "maxH": 36
  },
  "dependencies": [],
  "mockdata": []
}