{
  "cid": "digital-samples-brightdown",
  "widgetSize": {
    "minW": 8,
    "minH": 7,
    "maxW": 12,
    "maxH": 36
  },
  "name": "Samples (Digital: Brightness Down)",
  "description": "To generate sample images for digital corruptions (brightness down)",
  "dependencies": [
    {
      "cid": "aiverify_digital_corruptions"
    }
  ],
  "mockdata": [
    {
      "type": "Algorithm",
      "cid": "aiverify_digital_corruptions",
      "datapath": "digital-corruption-mock-data.json"
    }
  ]
}