{
  "cid": "text1",
  "name": "Text",
  "tags": ["stock", "decorator", "text"],
  "properties": [
    {
      "key": "text",
      "helper": "Enter your text",
      "default": ""
    }
  ],
  "widgetSize": {
    "minW": 1,
    "minH": 1,
    "maxW": 12,
    "maxH": 36
  },
  "dependencies": [],
  "mockdata": []
}