{
  "cid": "overall_summary",
  "widgetSize": {
    "minW": 12,
    "minH": 14,
    "maxW": 12,
    "maxH": 36
  },
  "name": "Overall Summary",
  "description": "Summary of all the processs checklists responses",
  "dependencies": [
    {
      "cid": "generic_process_checklist"
    },
    {
      "cid": "fairness_process_checklist"
    }
  ],
  "mockdata": [
    {
      "type": "InputBlock",
      "cid": "generic_process_checklist",
      "datapath": "generic_process_checklist.sample.json"
    },
    {
      "type": "InputBlock",
      "cid": "fairness_process_checklist",
      "datapath": "fairness_process_checklist.sample.json"
    }
  ]
}
