{
  "cid": "blur-samples",
  "widgetSize": {
    "minW": 8,
    "minH": 7,
    "maxW": 12,
    "maxH": 36
  },
  "name": "Blur samples",
  "description": "To generate sample images for blur corruptions",
  "dependencies": [
    {
      "cid": "aiverify_blur_corruptions"
    }
  ],
  "mockdata": [
    {
      "type": "Algorithm",
      "cid": "aiverify_blur_corruptions",
      "datapath": "blur-corruption-mock-data.json"
    }
  ]
}
