{
  "cid": "environment-samples-snow",
  "widgetSize": {
    "minW": 8,
    "minH": 7,
    "maxW": 12,
    "maxH": 36
  },
  "name": "Samples (Environment: Snow)",
  "description": "To generate sample images for environment corruptions (snow)",
  "dependencies": [
    {
      "cid": "aiverify_environment_corruptions"
    }
  ],
  "mockdata": [
    {
      "type": "Algorithm",
      "cid": "aiverify_environment_corruptions",
      "datapath": "environment-corruption-mock-data.json"
    }
  ]
}