{
  "cid": "summary_recommendation",
  "widgetSize": {
    "minW": 6,
    "minH": 3,
    "maxW": 12,
    "maxH": 36
  },
  "name": "Interpretation (Summary)",
  "description": "To provide interpretation and recommendations to the results",
  "dependencies": [
    {
      "cid": "fairness_tree"
    },
    {
      "cid": "fairness_metrics_toolbox_for_classification"
    }
  ],
  "mockdata": [
    {
      "type": "InputBlock",
      "cid": "fairness_tree",
      "datapath": "fairness_tree.sample.json"
    },
    {
      "type": "Algorithm",
      "cid": "fairness_metrics_toolbox_for_classification",
      "datapath": "fmt.output.sample.json" 
    }
  ]
}