{
  "cid": "environment-bar-chart",
  "widgetSize": {
    "minW": 12,
    "minH": 10,
    "maxW": 12,
    "maxH": 36
  },
  "name": "Bar Chart (Environment Corruptions)",
  "description": "To generate bar charts to visualise the accuracy results when environment corruptions are applied",
  "dependencies": [
    {
      "cid": "aiverify_environment_corruptions"
    }
  ],
  "mockdata": [
    {
      "type": "Algorithm",
      "cid": "aiverify_environment_corruptions",
      "datapath": "environment-corruption-mock-data.json"
    }
  ]
}
