{
  "cid": "summary_description",
  "widgetSize": {
    "minW": 6,
    "minH": 3,
    "maxW": 12,
    "maxH": 36
  },
  "description": "To provide an introduction to the Fairness Metrics Toolbox for Classification",
  "name": "Description (Summary)",
  "dependencies": [
    {
      "cid": "fairness_tree",
      "gid": "aiverify.stock.fairness_metrics_toolbox_for_classification"
    },
    {
      "cid": "fairness_metrics_toolbox_for_classification",
      "gid": "aiverify.stock.fairness_metrics_toolbox_for_classification"
    }
  ],
  "mockdata": [
    {
      "type": "InputBlock",
      "cid": "fairness_tree",
      "datapath": "fairness_tree.sample.json"
    },
    {
      "type": "Algorithm",
      "cid": "fairness_metrics_toolbox_for_classification",
      "datapath": "fmt.output.sample.json" 
    }
  ]
}