{
  "cid": "environment-line-chart",
  "widgetSize": {
    "minW": 12,
    "minH": 10,
    "maxW": 12,
    "maxH": 36
  },
  "name": "Line Chart (Environment Corruptions)",
  "description": "To generate line charts to visualise the accuracy results when environment corruptions (rain, fog and snow) are applied",
  "dependencies": [
    {
      "cid": "aiverify_environment_corruptions"
    }
  ],
  "mockdata": [
    {
      "type": "Algorithm",
      "cid": "aiverify_environment_corruptions",
      "datapath": "environment-corruption-mock-data.json"
    }
  ]
}