{
  "cid": "blur-line-chart",
  "widgetSize": {
    "minW": 12,
    "minH": 10,
    "maxW": 12,
    "maxH": 36
  },
  "name": "Line Chart (Blur Corruptions)",
  "description": "To generate line charts to visualise the accuracy results when blur corruptions (defocus, gaussian, glass, horizontal motion, vertical motion and zoom blur) are applied",
  "dependencies": [
    {
      "cid": "aiverify_blur_corruptions"
    }
  ],
  "mockdata": [
    {
      "type": "Algorithm",
      "cid": "aiverify_blur_corruptions",
      "datapath": "blur-corruption-mock-data.json"
    }
  ]
}